Nazev;Autor;Spoluautori;DruhPublikace;Deponovano;SystemoveCislo;EvidencniCisloFEL;EvidencniCisloOddeleni;CarovyKod;PocetStran;Vydani;RokVydani;Vydavatel;ZemeVydani;ISBNorISSN;CisloCasopisu;RocnikCasopisu;Konference;Cena;KlicovaSlova;Poznamka;Vlozeno;ZapujcenoKomu;ZapujcenoOd;ZapujcenoDo;FormType;IntStatus;Extra3;Extra4;Extra5;StsCheck;StsUK;
Time to Go: A Mobile App for Navigation and Time Management II;Musil, Jan;;Bach.Th.;Katedra;;;BT-2014-0001;;34;1;2014;Czech Technical University in Prague;Praha;;;;;;;s CD, neobhájeno;;VOLNÁ;;;;;;;;;;
Time to Go: A Mobile App for Navigation and Time Management I;Musil, Jan;;Bach.Th.;Katedra;;;BT-2014-0002;;34;1;2014;Czech Technical University in Prague;Praha;;;;;;;s CD, neobhájeno;;VOLNÁ;;;;;;;;;;
Cooperative formations on highway;Borovec, Ondřej;;Bach.Th.;Katedra;;;BT-2015-0001;;61;1;2015;ČVUT Praha - FEL;ČR;;;;;;;vč. CD;;VOLNÁ;;;;;;;;;;
Checkers with Artificial Intelligence;Doležal, Matěj;;Bach.Th.;Katedra;;;BT-2015-0002;;37;1;2015;ČVUT Praha - FEL;ČR;;;;;;;vč. CD;;VOLNÁ;;;;;;;;;;
Android aplikace pro plánování cyklistických tras a cyklonavigaci;Linka, Jan;;Bach.Th.;Katedra;;;BT-2015-0003;;47;1;2015;ČVUT Praha - FEL;ČR;;;;;;;vč. CD;;VOLNÁ;;;;;;;;;;
Planning of Swarm Deployment for Autonomous Surveillance;Petrlík, Matěj;;Bach.Th.;Katedra;;;BT-2015-0004;;65;1;2015;ČVUT Praha - FEL;ČR;;;;;;;vč. CD;;VOLNÁ;;;;;;;;;;
SW a HW Integration of an IP PTZ camera onto a Mobile Outdoor Robot;Chmel, Jakub;;Bach.Th.;Katedra;;;BT-2015-0005;;41;1;2015;ČVUT Praha - FEL;ČR;;;;;;;vč. CD;;VOLNÁ;;;;;;;;;;
Analýza behaviorálních dat nadaných a průměrně nadaných adolescentů;Dvořák, Jakub;;Bach.Th.;Katedra;;;BT-2015-0006;;54;1;2015;ČVUT Praha - FEL;ČR;;;;;;;vč. CD;;VOLNÁ;;;;;;;;;;
Motion Control for a Humanoid;Janů, Vojtěch;;Bach.Th.;Katedra;;;BT-2015-0007;;31;1;2015;ČVUT Praha - FEL;ČR;;;;;;;vč. CD;;VOLNÁ;;;;;;;;;;
Analýza rozdílů EEG signálu nadaných a průměrně nadaných adolescentů;Bukovský, Petr;;Bach.Th.;Katedra;;;BT-2015-0008;;54;1;2015;ČVUT Praha - FEL;ČR;;;;;;;vč. CD;;VOLNÁ;;;;;;;;;;
Web Front-End for Student Data Analysis Application;Václavek, Jonáš;;Bach.Th.;Katedra;;;BT-2015-0009;;41;1;2015;ČVUT Praha - FEL;ČR;;;;;;;vč. CD;;VOLNÁ;;;;;;;;;;
Inteligentní heliport pro bezpilotní helikoptéry;Kunte, Ondřej;;Bach.Th.;Katedra;;;BT-2015-0010;;55;1;2015;ČVUT Praha - FEL;ČR;;;;;;;vč. CD;;VOLNÁ;;;;;;;;;;
Extension of the Control System for the Magnetic Manipulator with a Non-Flat Surface;Filip, Jan;;Bach.Th.;Katedra;;;BT-2015-0011;;50;1;2015;ČVUT Praha - FEL;ČR;;;;;;;vč. CD;;VOLNÁ;;;;;;;;;;
Synchronized Control of Group of Helicopters Using Direct Communication;Fiedler, Jiří;;Bach.Th.;Katedra;;;BT-2015-0012;;62;1;2015;ČVUT Praha - FEL;ČR;;;;;;;vč. CD;;SASKA, MARTIN;;;;;;;;;;
The Use of Symbolic Execution for Testing of Real-Time Safety-Related Software;Hořenovský, Martin;;Bach.Th.;Katedra;;;BT-2015-0013;;32;1;2015;ČVUT Praha - FEL;ČR;;;;;;;vč. CD;;VOLNÁ;;;;;;;;;;
Využití GPS záznamů tras pro odhady dojezdových časů v dopravních sítích;Slunečko, Daniel;;Bach.Th.;Katedra;;;BT-2015-0014;;50;1;2015;ČVUT Praha - FEL;ČR;;;;;;;vč. CD;;VOLNÁ;;;;;;;;;;
Stackelberg Equilibria in Normal Form Games with Sequential Strategies;Rindt, Eduard;;Bach.Th.;Katedra;;;BT-2015-0015;;36;1;2015;ČVUT Praha - FEL;ČR;;;;;;;vč. CD;;VOLNÁ;;;;;;;;;;
Automatic Coloring Book on Touch Devices with OS Android;Steidl, Stanislav;;Bach.Th.;Katedra;;;BT-2015-0016;;49;1;2015;ČVUT Praha - FEL;ČR;;;;;;;vč. CD;;VOLNÁ;;;;;;;;;;
Algoritmus pro munerickou integraci Kuzněcovovy rovnice na GPU;Mrňa, Jan;;Bach.Th.;Katedra;;;BT-2015-0017;;44;1;2015;ČVUT Praha - FEL;ČR;;;;;;;vč. CD;;VOLNÁ;;;;;;;;;;
Otevření portálu Spolupráce s průmyslem pro více univerzit;Balák, Zdeněk;;Bach.Th.;Katedra;;;BT-2015-0018;;51;1;2015;ČVUT Praha - FEL;ČR;;;;;;;vč. CD;;VOLNÁ;;;;;;;;;;
Implementace fúzního obrazu z termokamery pro systém UAV;Kovář, Petr;;Bach.Th.;Katedra;;;BT-2015-0019;;45;1;2015;ČVUT Praha - FEL;ČR;;;;;;;vč. CD;;VOLNÁ;;;;;;;;;;
Navigation and Stabilization of Swarms of Micro Aerial Vehicles in Complex Environment;Všetečka, Petr;;Bach.Th.;Katedra;;;BT-2015-0020;;39;1;2015;ČVUT Praha - FEL;ČR;;;;;;;vč. CD;;SASKA, MARTIN;;;;;;;;;;
Convergence of UCT in Games with Imperfect Information;Briedoň, Marián;;Bach.Th.;Katedra;;;BT-2015-0021;;35;1;2015;ČVUT Praha - FEL;ČR;;;;;;;vč. CD;;VOLNÁ;;;;;;;;;;
Měření barevných broušených kamenů;Drápela, Jakub;;Bach.Th.;Katedra;;;BT-2015-0022;;38;1;2015;ČVUT Praha - FEL;ČR;;;;;;;vč. CD;;VOLNÁ;;;;;;;;;;
Ovládání kolony vozidel ze systému Android pomocí protokolu Zigbee;Dubeň, Alexander;;Bach.Th.;Katedra;;;BT-2015-0023;;49;1;2015;ČVUT Praha - FEL;ČR;;;;;;;vč. CD;;VOLNÁ;;;;;;;;;;
Implementace audio-knihovny pro zrakově handicapované uživatele;Rubeš, Lukáš;;Bach.Th.;Katedra;;;BT-2015-0024;;49;1;2015;ČVUT Praha - FEL;ČR;;;;;;;vč. CD;;VOLNÁ;;;;;;;;;;
User Interface and Failure Detection for Support of Multi-MAV Experiments;Klučka, Martin;;Bach.Th.;Katedra;;;BT-2015-0025;;43;1;2015;ČVUT Praha - FEL;ČR;;;;;;;vč. CD;;SASKA, MARTIN;;;;;;;;;;
Lokalizace osob v budově s využitím bezdrátové technologie;Trejbal, Jan;;Bach.Th.;Katedra;;;BT-2015-0026;;29;1;2015;ČVUT Praha - FEL;ČR;;;;;;;vč. CD;;VOLNÁ;;;;;;;;;;
Analysis of Scaling in Distributed Control;Konrád, Jakub;;Bach.Th.;Katedra;;;BT-2015-0027;;47;1;2015;ČVUT Praha - FEL;ČR;;;;;;;vč. CD;;VOLNÁ;;;;;;;;;;
Využití výsledků projektů realizovaných přes portál Spolupráce s průmyslem;Král, Martin;;Bach.Th.;Katedra;;;BT-2015-0028;;43;1;2015;ČVUT Praha - FEL;ČR;;;;;;;vč. CD;;VOLNÁ;;;;;;;;;;
Odhad pohlaví a věku z videa lidské tváře;Krček, Jan;;Bach.Th.;Katedra;;;BT-2015-0029;;22;1;2015;ČVUT Praha - FEL;ČR;;;;;;;vč. CD;;VOLNÁ;;;;;;;;;;
Minimal Problem Solver Generator;Trutman, Pavel;;Bach.Th.;Katedra;;;BT-2015-0030;;42;1;2015;ČVUT Praha - FEL;ČR;;;;;;;vč. CD;;VOLNÁ;;;;;;;;;;
Smooth Trajectory Generation in 2D;Niedoba, Lukáš;;Bach.Th.;Katedra;;;BT-2015-0031;;36;1;2015;ČVUT Praha - FEL;ČR;;;;;;;vč. CD;;VOLNÁ;;;;;;;;;;
Relatively Stabilized Unmanned Helicopters Led by Dynamic Virtual Leader;Heřt, Daniel;;Bach.Th.;Katedra;;;BT-2015-0032;;36;1;2015;ČVUT Praha - FEL;ČR;;;;;;;vč. CD;;SASKA, MARTIN;;;;;;;;;;
Self-Organizing Structures for the Travelling Salesman Problem in a Polygonal Domain;Sushkov, Roman;;Bach.Th.;Katedra;;;BT-2015-0033;;38;1;2015;ČVUT Praha - FEL;ČR;;;;;;;vč. CD;;VOLNÁ;;;;;;;;;;
Inteligentní algoritmy pro inspekci benzinových stanic;Jandová, Kateřina;;Bach.Th.;Katedra;;;BT-2015-0034;;54;1;2015;ČVUT Praha - FEL;ČR;;;;;;;vč. CD;;VOLNÁ;;;;;;;;;;
Katalogizace uživatelů na základě historie stahovaných webových dokumentů;Jenčík, Dušak;;Bach.Th.;Katedra;;;BT-2015-0035;;50;1;2015;ČVUT Praha - FEL;ČR;;;;;;;vč. CD;;VOLNÁ;;;;;;;;;;
Reprezentace proprioceptivních vstupů humanoidního robota iCub pomocí samoorganizujících se map;Bednářová, Naďa;;Bach.Th.;Katedra;;;BT-2015-0036;;33;1;2015;ČVUT Praha - FEL;ČR;;;;;;;vč. CD;;VOLNÁ;;;;;;;;;;
Využití robota LEGO MINDSTORMS při výuce - návrh soutěžních úloh;Dubovic, Jakub;;Bach.Th.;Katedra;;;BT-2015-0037;;36;1;2015;ČVUT Praha - FEL;ČR;;;;;;;vč. CD;;VOLNÁ;;;;;;;;;;
Intelligent Algorithms for Optimal Exploration and Exploatation in Dynamic Environment;Marek, Petr;;Bach.Th.;Katedra;;;BT-2015-0038;;37;1;2015;ČVUT Praha - FEL;ČR;;;;;;;vč. CD;;VOLNÁ;;;;;;;;;;
Optimalizace inspekčních procesů klinických testů;Ondráčková, Lada;;Bach.Th.;Katedra;;;BT-2015-0039;;44;1;2015;ČVUT Praha - FEL;ČR;;;;;;;vč. CD;;VOLNÁ;;;;;;;;;;
Identifikace modelů fyzikálních procesů v silničních tunelech;Talíř, Vojtěch;;Bach.Th.;Katedra;;;BT-2015-0040;;68;1;2015;ČVUT Praha - FEL;ČR;;;;;;;vč. CD;;VOLNÁ;;;;;;;;;;
Učení se strategií ve stochastických hrách s nulovým součtem;Futschik, David;;Bach.Th.;Katedra;;;BT-2015-0041;;36;1;2015;ČVUT Praha - FEL;ČR;;;;;;;vč. CD;;VOLNÁ;;;;;;;;;;
Automatic Name and Snippet Generation of Web Pages with Unknown Content;Amrich, Jonáš;;Bach.Th.;Katedra;;;BT-2015-0042;;28;1;2015;ČVUT Praha - FEL;ČR;;;;;;;vč. CD;;VOLNÁ;;;;;;;;;;
Zobrazení dat uložených v Univerzálním úložišti;Kuchař, Pavel;;Bach.Th.;Katedra;;;BT-2015-0043;;45;1;2015;ČVUT Praha - FEL;ČR;;;;;;;vč. CD;;VOLNÁ;;;;;;;;;;
Automatická detekce akčních potenciálů neuronů z mikroelektrodových signálů;Zamouřil, Jakub;;Bach.Th.;Katedra;;;BT-2015-0044;;39;1;2015;ČVUT Praha - FEL;ČR;;;;;;;vč. CD;;VOLNÁ;;;;;;;;;;
Congruences on Finite Automata;Grimová, Nela;;Bach.Th.;Katedra;;;BT-2015-0045;;31;1;2015;ČVUT Praha - FEL;ČR;;;;;;;vč. CD;;VOLNÁ;;;;;;;;;;
Efficient Many-to-many RANSAC;Šerých, Jonáš;;Bach.Th.;Katedra;;;BT-2015-0046;;39;1;2015;ČVUT Praha - FEL;ČR;;;;;;;vč. CD;;VOLNÁ;;;;;;;;;;
Increasing Weak Classifier Diversity in Ensemble Models by Feature Graphs;Kunc, Vladimír;;Bach.Th.;Katedra;;;BT-2015-0047;;92;1;2015;ČVUT Praha - FEL;ČR;;;;;;;vč. CD;;VOLNÁ;;;;;;;;;;
Asynchronous Decentralized Prioritized Planning for Cooperative Vehicles;Vavřinec, Matěj;;Bach.Th.;Katedra;;;BT-2015-0048;;37;1;2015;ČVUT Praha - FEL;ČR;;;;;;;vč. CD;;VOLNÁ;;;;;;;;;;
Analýza použitelnosti pebble-motion algoritmů pro koordinaci trajektorií v multi-robotickém týmu;Vašek, Jakub;;Bach.Th.;Katedra;;;BT-2015-0049;;32;1;2015;ČVUT Praha - FEL;ČR;;;;;;;vč. CD;;VOLNÁ;;;;;;;;;;
Automatický obchodní systém s fuzzy strategií;Kasimov, Yury;;Bach.Th.;Katedra;;;BT-2015-0050;;42;1;2015;ČVUT Praha - FEL;ČR;;;;;;;vč. CD;;VOLNÁ;;;;;;;;;;
Using Sequence-Form Double-Oracle Algorithm for Simplified Poker;Munch, Martin;;Bach.Th.;Katedra;;;BT-2015-0051;;39;1;2015;ČVUT Praha - FEL;ČR;;;;;;;vč. CD;;VOLNÁ;;;;;;;;;;
Time to Go: A Mobile App for Navigation and Time Management;Musil, Jan;;Bach.Th.;Katedra;;;BT-2015-0052;;69;1;2015;ČVUT Praha - FEL;ČR;;;;;;;vč. CD;;VOLNÁ;;;;;;;;;;
Call centrum pro průzkum spokojenosti zákazníků;Dendis, Martin;;Bach.Th.;Katedra;;;BT-2015-0053;;56;1;2015;ČVUT Praha - FEL;ČR;;;;;;;vč. CD;;VOLNÁ;;;;;;;;;;
Metody generování strategií pro stochastické hry s nulovým součtem;Kryška, Marek;;Bach.Th.;Katedra;;;BT-2015-0054;;27;1;2015;ČVUT Praha - FEL;ČR;;;;;;;vč. CD;;VOLNÁ;;;;;;;;;;
Aplikace pro vyhodnocení experimentu prováděného v aerodynamickém tunelu;Riss, Štěpán;;Bach.Th.;Katedra;;;BT-2015-0055;;26;1;2015;ČVUT Praha - FEL;ČR;;;;;;;vč. CD;;VOLNÁ;;;;;;;;;;
Multiple Trajectory Smoothing for Teams of Closely Cooperating Micro Aerial Vehicles;Hobza, Martin;;Bach.Th.;Katedra;;;BT-2015-0056;;20;1;2015;ČVUT Praha - FEL;ČR;;;;;;;vč. CD;;SASKA, MARTIN;;;;;;;;;;
Collision Avoidance on General Road Network;Kubeša, David;;Bach.Th.;Katedra;;;BT-2015-0057;;48;1;2015;ČVUT Praha - FEL;ČR;;;;;;;vč. CD;;VOLNÁ;;;;;;;;;;
Program pro kontrolu zranitelnosti bezdrátových sítí;Rindt, Jan;;Bach.Th.;Katedra;;;BT-2015-0058;;40;1;2016;ČVUT Praha - FEL;ČR;;;;;;;vč. CD;;VOLNÁ;;;;;;;;;;
Systém měření času dynamických disciplín soutěže Formula Student;Jirásek, Ondřej;;Bach.Th.;Katedra;;;BT-2016-0001;;28;1;2016;ČVUT Praha - FEL;ČR;;;;;;;vč. CD;;VOLNÁ;;;;;;;;;;
Coherent swarming of micro aerial vehicles with minimum computational and communication requirements;Brandtner, Daniel;;Bach.Th.;Katedra;;;BT-2016-0002;;54;1;2016;ČVUT Praha - FEL;ČR;;;;;;;vč. CD;;VOLNÁ;;;;;;;;;;
Extensions of the Vehicle Routing Problem;Klímová, Kateřina;;Bach.Th.;Katedra;;;BT-2016-0003;;53;1;2016;ČVUT Praha - FEL;ČR;;;;;;;vč. CD;;VOLNÁ;;;;;;;;;;
Návrh seriózní hry pro edukaci děti trpících diabetes mellitus;Kejvalová, Jana;;Bach.Th.;Katedra;;;BT-2016-0004;;34;1;2016;ČVUT Praha - FEL;ČR;;;;;;;vč. CD;;VOLNÁ;;;;;;;;;;
Frekvenční analýza spánkových EEG signálů;Paštyka, Jan;;Bach.Th.;Katedra;;;BT-2016-0005;;50;1;2016;ČVUT Praha - FEL;ČR;;;;;;;vč. CD;;VOLNÁ;;;;;;;;;;
Submarine Behaviour Model for Monte Carlo Simulations;Dlask, Tomáš;;Bach.Th.;Katedra;;;BT-2016-0006;;73;1;2016;ČVUT Praha - FEL;ČR;;;;;;;vč. CD;;VOLNÁ;;;;;;;;;;
Vehicle Routing Problem with Multiple Time Windows;Eichler, Petr;;Bach.Th.;Katedra;;;BT-2016-0007;;45;1;2016;ČVUT Praha - FEL;ČR;;;;;;;vč. CD;;VOLNÁ;;;;;;;;;;
Simulační Model Rezidenčního Plynového Kotle;Vobr, David;;Bach.Th.;Katedra;;;BT-2016-0008;;37;1;2016;ČVUT Praha - FEL;ČR;;;;;;;vč. CD;;VOLNÁ;;;;;;;;;;
A Distributed Load Balancing Algorithm for Networks with Hard Mapping Constraints;Lebedeva, Anastasia;;Bach.Th.;Katedra;;;BT-2016-0009;;41;1;2016;ČVUT Praha - FEL;ČR;;;;;;;vč. CD;;VOLNÁ;;;;;;;;;;
Learn and Predict Metasploit Exploit Rand from Availability Vulnerability Information;Gavenčiak, Karel;;Bach.Th.;Katedra;;;BT-2016-0010;;37;1;2016;ČVUT Praha - FEL;ČR;;;;;;;vč. CD;;VOLNÁ;;;;;;;;;;
Algorithm with Quality-Runtime Tredeoff Parameter for Attack Policy in Attack Graphs for Network Security;Babayeva, Elnaz;;Bach.Th.;Katedra;;;BT-2016-0011;;40;1;2016;ČVUT Praha - FEL;ČR;;;;;;;vč. CD;;VOLNÁ;;;;;;;;;;
Mapování Vnitřního Prostředí Autonomní Helikoptérou;Česenek, David;;Bach.Th.;Katedra;;;BT-2016-0012;;61;1;2016;ČVUT Praha - FEL;ČR;;;;;;;vč. CD;;VOLNÁ;;;;;;;;;;
Interactive Visualization System for Hybrid Active Pixel Detections Within the ATLAS Experiment at CERN;Mánek, Petr;;Bach.Th.;Katedra;;;BT-2016-0013;;55;1;2016;ČVUT Praha - FEL;ČR;;;;;;;vč. CD;;VOLNÁ;;;;;;;;;;
Neural Network Based Motion Control of Hexapod Walking Robot;Milička, Pavel;;Bach.Th.;Katedra;;;BT-2016-0014;;35;1;2016;ČVUT Praha - FEL;ČR;;;;;;;vč. CD;;VOLNÁ;;;;;;;;;;
Meřící Přístroj Kruhovosti Součástek;Brázdil, Jiří;;Bach.Th.;Katedra;;;BT-2016-0015;;41;1;2016;ČVUT Praha - FEL;ČR;;;;;;;vč. CD;;VOLNÁ;;;;;;;;;;
Systém pro Personální Lokalizaci;Bláha, Richard;;Bach.Th.;Katedra;;;BT-2016-0016;;55;1;2016;ČVUT Praha - FEL;ČR;;;;;;;vč. CD;;VOLNÁ;;;;;;;;;;
Experimentální Platforma pro Rychké Prototypování Řídicích Algoritmů pro Stejnosměrný Motor s Permanentním Magnetem;Záhora, Jiří;;Bach.Th.;Katedra;;;BT-2016-0017;;31;1;2016;ČVUT Praha - FEL;ČR;;;;;;;vč. CD;;VOLNÁ;;;;;;;;;;
Návrh a Realizace Snímače Myosignálů;Kubeš, Daniel;;Bach.Th.;Katedra;;;BT-2016-0018;;60;1;2016;ČVUT Praha - FEL;ČR;;;;;;;vč. CD;;VOLNÁ;;;;;;;;;;
Geometry and Transformations in Deep Convolutional Neural Networks;Jakab, Tomáš;;Bach.Th.;Katedra;;;BT-2016-0019;;39;1;2016;ČVUT Praha - FEL;ČR;;;;;;;vč. CD;;VOLNÁ;;;;;;;;;;
Detection of Fast Moving Objects;Novotný, Lukáš;;Bach.Th.;Katedra;;;BT-2016-0020;;42;1;2016;ČVUT Praha - FEL;ČR;;;;;;;vč. CD;;VOLNÁ;;;;;;;;;;
Motion PLanning for Swarms of Unmanned Helicopters in Complex Environment;Brich, Tomáš;;Bach.Th.;Katedra;;;BT-2016-0021;;33;1;2016;ČVUT Praha - FEL;ČR;;;;;;;vč. CD;;VOLNÁ;;;;;;;;;;
Periferní Modul pro Řízení Stejnosměrných Motorů pro Platformu Zynq;Nepivoda, Tomáš;;Bach.Th.;Katedra;;;BT-2016-0022;;37;1;2016;ČVUT Praha - FEL;ČR;;;;;;;vč. CD;;VOLNÁ;;;;;;;;;;
Integrace Audio Knihovny;Krýže, Petr;;Bach.Th.;Katedra;;;BT-2016-0023;;57;1;2016;ČVUT Praha - FEL;ČR;;;;;;;vč. CD;;VOLNÁ;;;;;;;;;;
Text Recognition in Images Using Recurrent Neural Networks;Moravová, Alena;;Bach.Th.;Katedra;;;BT-2016-0024;;41;1;2016;ČVUT Praha - FEL;ČR;;;;;;;vč. CD;;VOLNÁ;;;;;;;;;;
Experimentál Evaluation of Abstractions with Imperfect Recall;Hlaváček, Michael;;Bach.Th.;Katedra;;;BT-2016-0025;;35;1;2016;ČVUT Praha - FEL;ČR;;;;;;;vč. CD;;VOLNÁ;;;;;;;;;;
Automatizace Záznamu, Měření a Zpracování AV Charakteristik;Petrova, Olga;;Bach.Th.;Katedra;;;BT-2016-0026;;36;1;2016;ČVUT Praha - FEL;ČR;;;;;;;vč. CD;;VOLNÁ;;;;;;;;;;
Scalable Agent Navigation in Crowd Simulation;Prágr, Myloš;;Bach.Th.;Katedra;;;BT-2016-0027;;57;1;2016;ČVUT Praha - FEL;ČR;;;;;;;vč. CD;;VOLNÁ;;;;;;;;;;
Dialog System of Question Answering;Marek, Petr;;Bach.Th.;Katedra;;;BT-2016-0028;;49;1;2016;ČVUT Praha - FEL;ČR;;;;;;;vč. CD;;VOLNÁ;;;;;;;;;;
Modeling Cyclist Behaviour Using Machine Learning;Langer, Filip;;Bach.Th.;Katedra;;;BT-2016-0029;;48;1;2016;ČVUT Praha - FEL;ČR;;;;;;;vč. CD;;VOLNÁ;;;;;;;;;;
Planner Comparision to Assess Journey PLanning Quality;Korekov, Denis;;Bach.Th.;Katedra;;;BT-2016-0030;;49;1;2016;ČVUT Praha - FEL;ČR;;;;;;;vč. CD;;VOLNÁ;;;;;;;;;;
FPGA Based CAN Bus Channel Mutual Latency Tester and Evaluation;Jeřábek, Martin;;Bach.Th.;Katedra;;;BT-2016-0031;;54;1;2016;ČVUT Praha - FEL;ČR;;;;;;;vč. CD;;VOLNÁ;;;;;;;;;;
Distributed Control of an Array of Light Source;Pučejdl, Krištov;;Bach.Th.;Katedra;;;BT-2016-0032;;44;1;2016;ČVUT Praha - FEL;ČR;;;;;;;vč. CD;;VOLNÁ;;;;;;;;;;
Experimenty s Ultralehkou Membránou v Blízkém Akustickém Poli;Ermokhina, Angelina;;Bach.Th.;Katedra;;;BT-2016-0033;;47;1;2016;ČVUT Praha - FEL;ČR;;;;;;;vč. CD;;VOLNÁ;;;;;;;;;;
Lifelong Localization of Mobile Robot;Kapošváry, Matěj;;Bach.Th.;Katedra;;;BT-2016-0034;;61;1;2016;ČVUT Praha - FEL;ČR;;;;;;;vč. CD;;VOLNÁ;;;;;;;;;;
Hidden Variables in Mathematical Models of Quantum Structures;Petr, Matěj;;Bach.Th.;Katedra;;;BT-2016-0035;;31;1;2016;ČVUT Praha - FEL;ČR;;;;;;;vč. CD;;VOLNÁ;;;;;;;;;;
Sopwith - Letecká Retrohra pro Android;Karimi, Daniel;;Bach.Th.;Katedra;;;BT-2016-0036;;35;1;2016;ČVUT Praha - FEL;ČR;;;;;;;vč. CD;;VOLNÁ;;;;;;;;;;
Semantic Parsing of Questions;Matulík, Martin;;Bach.Th.;Katedra;;;BT-2016-0037;;38;1;2016;ČVUT Praha - FEL;ČR;;;;;;;vč. CD;;VOLNÁ;;;;;;;;;;
Motion Planning for Modular Robots Under Failures;Lamper, Daniel;;Bach.Th.;Katedra;;;BT-2016-0038;;39;1;2016;ČVUT Praha - FEL;ČR;;;;;;;vč. CD;;VOLNÁ;;;;;;;;;;
Path Planning in Pretein Structures;Jankovec, Tom;;Bach.Th.;Katedra;;;BT-2016-0039;;65;1;2016;ČVUT Praha - FEL;ČR;;;;;;;vč. CD;;VOLNÁ;;;;;;;;;;
Model Predictive Control of Anmanned Helicopter with Obstacle Avoidance;Bouček, Jan;;Bach.Th.;Katedra;;;BT-2016-0040;;50;1;2016;ČVUT Praha - FEL;ČR;;;;;;;vč. CD;;VOLNÁ;;;;;;;;;;
Object Detection in High Resolution Satelite Images;Azayev, Teymur;;Bach.Th.;Katedra;;;BT-2016-0041;;55;1;2016;ČVUT Praha - FEL;ČR;;;;;;;vč. CD;;VOLNÁ;;;;;;;;;;
Cooperative Tracking of a Moving Object by a Formation of Unmanned Helicopters;Cibulka, Vít;;Bach.Th.;Katedra;;;BT-2016-0042;;40;1;2016;ČVUT Praha - FEL;ČR;;;;;;;vč. CD;;VOLNÁ;;;;;;;;;;
Vývoj Robotické Buňky pro Manupilaci s PLastovými Rourami;Hajdůšek, Lukáš;;Bach.Th.;Katedra;;;BT-2016-0043;;85;1;2016;ČVUT Praha - FEL;ČR;;;;;;;vč. CD;;VOLNÁ;;;;;;;;;;
Vizuální lokalizace pro Experimentaci v Mobilní Robotice;Pivoňka, Tomáš;;Bach.Th.;Katedra;;;BT-2016-0044;;39;1;2016;ČVUT Praha - FEL;ČR;;;;;;;vč. CD;;VOLNÁ;;;;;;;;;;
Vývoj Integračního Adaptéru pr IBM TRC a Blueworks Live;Bakeyev, Ruslan;;Bach.Th.;Katedra;;;BT-2016-0045;;30;1;2016;ČVUT Praha - FEL;ČR;;;;;;;vč. CD;;VOLNÁ;;;;;;;;;;
Optimální Řízení Akumulátorového Úložiště v Budově;Žaitlík, David;;Bach.Th.;Katedra;;;BT-2016-0046;;61;1;2016;ČVUT Praha - FEL;ČR;;;;;;;vč. CD;;VOLNÁ;;;;;;;;;;
Plánování Trajektorie Bezpilotního Prostředku pro Inspekci 3D Objektů;Chloupek, Martin;;Bach.Th.;Katedra;;;BT-2016-0047;;44;1;2016;ČVUT Praha - FEL;ČR;;;;;;;vč. CD;;VOLNÁ;;;;;;;;;;
Application for Feature Extraction from Eye Movement Signal Analysis;Melkumov, Ivan;;Bach.Th.;Katedra;;;BT-2016-0048;;34;1;2016;ČVUT Praha - FEL;ČR;;;;;;;vč. CD;;VOLNÁ;;;;;;;;;;
Detekce Zakládní Hlasivkové Frekvence na Bázi Prodloužené Fonace u Pacientů s Poruchami Hlasu;Suchý, Filip;;Bach.Th.;Katedra;;;BT-2016-0049;;39;1;2016;ČVUT Praha - FEL;ČR;;;;;;;vč. CD;;VOLNÁ;;;;;;;;;;
Game-Theoretic Model of Route for Maritime Smuggling Operations;Drtina, Tomáš;;Bach.Th.;Katedra;;;BT-2016-0050;;33;1;2016;ČVUT Praha - FEL;ČR;;;;;;;vč. CD;;VOLNÁ;;;;;;;;;;
Detectiong Objects for Autonomous System Verification;Jašek, Otakar;;Bach.Th.;Katedra;;;BT-2016-0051;;50;1;2016;ČVUT Praha - FEL;ČR;;;;;;;vč. CD;;VOLNÁ;;;;;;;;;;
Active Searching of RFID Chips by a Group of Relatively Stabilized Helicopters;Vrba, Václav;;Bach.Th.;Katedra;;;BT-2016-0052;;38;1;2016;ČVUT Praha - FEL;ČR;;;;;;;vč. CD;;VOLNÁ;;;;;;;;;;
Onboard Altitude Controller with State Feedback and State Observer;Puciow, František;;Bach.Th.;Katedra;;;BT-2016-0053;;50;1;2016;ČVUT Praha - FEL;ČR;;;;;;;vč. CD;;VOLNÁ;;;;;;;;;;
Neural Networks for Humanoid Robot Control;Stanko, Silvestr;;Bach.Th.;Katedra;;;BT-2016-0054;;44;1;2016;ČVUT Praha - FEL;ČR;;;;;;;vč. CD;;VOLNÁ;;;;;;;;;;
Conditional Probability Models in Transportations;Šinkovec, Petr;;Bach.Th.;Katedra;;;BT-2016-0055;;39;1;2016;ČVUT Praha - FEL;ČR;;;;;;;vč. CD;;VOLNÁ;;;;;;;;;;
RRT-Path Method Used for Cooperative Surveillance by Group of Helicopters;Račinský, Matěj;;Bach.Th.;Katedra;;;BT-2016-0056;;58;1;2016;ČVUT Praha - FEL;ČR;;;;;;;vč. CD;;VOLNÁ;;;;;;;;;;
Steinerův Bod a jeho Fuzzy Zobecnění;Benedikt, Ondřej;;Bach.Th.;Katedra;;;BT-2016-0057;;64;1;2016;ČVUT Praha - FEL;ČR;;;;;;;vč. CD;;VOLNÁ;;;;;;;;;;
Creation and Testing of Experimental Platform for Cognitive Load Experiments in Driving and Navigation;Marek, Ján;;Bach.Th.;Katedra;;;BT-2016-0058;;35;1;2016;ČVUT Praha - FEL;ČR;;;;;;;vč. CD;;VOLNÁ;;;;;;;;;;
Estimátor Produkce Fotovolaických Elektrálen;Holeček, Jaroslav;;Bach.Th.;Katedra;;;BT-2016-0059;;40;1;2016;ČVUT Praha - FEL;ČR;;;;;;;vč. CD;;VOLNÁ;;;;;;;;;;
Detekce Fůzních Neutronů;Pavlát, Adam;;Bach.Th.;Katedra;;;BT-2016-0060;;27;1;2016;ČVUT Praha - FEL;ČR;;;;;;;vč. CD;;VOLNÁ;;;;;;;;;;
Solving Stochastic Games with Imperfect Information;Tomášek, Petr;;Bach.Th.;Katedra;;;BT-2016-0061;;34;1;2016;ČVUT Praha - FEL;ČR;;;;;;;vč. CD;;VOLNÁ;;;;;;;;;;
Prototyp Logistiského Systému s Bezpilotními Letadly;Bouška, Michal;;Bach.Th.;Katedra;;;BT-2016-0062;;41;1;2016;ČVUT Praha - FEL;ČR;;;;;;;vč. CD;;VOLNÁ;;;;;;;;;;
Model Města pro Simulátor Auta;Čajka, Vladimír;;Bach.Th.;Katedra;;;BT-2016-0063;;62;1;2016;ČVUT Praha - FEL;ČR;;;;;;;vč. CD;;VOLNÁ;;;;;;;;;;
Algorithms for Minesweeper Game Grid Generation;Cicvárek, Jan;;Bach.Th.;Katedra;;;BT-2016-0064;;26;1;2016;ČVUT Praha - FEL;ČR;;;;;;;vč. CD;;VOLNÁ;;;;;;;;;;
Model Aktivnej Kontúry s Klúčovími Bodmi pre Detekciu Hranice Objektu v Obraze;Dvořák, Filip;;Bach.Th.;Katedra;;;BT-2016-0065;;33;1;2016;ČVUT Praha - FEL;ČR;;;;;;;vč. CD;;VOLNÁ;;;;;;;;;;
Posouzení Stability Letounu L410 se Zapojeným Autopilotem;Majer, Filip;;Bach.Th.;Katedra;;;BT-2017-0001;;25;1;2017;ČVUT Praha - FEL;ČR;;;;;;;vč. CD;01.06.2017;VOLNÁ;;;;;;;;;;
Image Captioning with Convolutional Neural Networks;Najman, Michael;;Bach.Th.;Katedra;;;BT-2017-0002;;47;1;2017;ČVUT Praha - FEL;ČR;;;;;;;vč. CD;01.06.2017;VOLNÁ;;;;;;;;;;
Implementace Encyklopedie (wikipedie) pro Zrakově Postižené Uživatele;Hrubý, Jaroslav;;Bach.Th.;Katedra;;;BT-2017-0003;;35;1;2017;ČVUT Praha - FEL;ČR;;;;;;;vč. CD;01.06.2017;VOLNÁ;;;;;;;;;;
Distributed Cohesive Control for Swarms of Mivro Aerial Vehicles;Charvát, Jan;;Bach.Th.;Katedra;;;BT-2017-0004;;45;1;2017;ČVUT Praha - FEL;ČR;;;;;;;vč. CD;01.06.2017;VOLNÁ;;;;;;;;;;
Integrated Route and Charging Planning for Eletric Vehicles;Fišer, Tomáš;;Bach.Th.;Katedra;;;BT-2017-0005;;51;1;2017;ČVUT Praha - FEL;ČR;;;;;;;vč. CD;01.06.2017;VOLNÁ;;;;;;;;;;
Model Města pro Simulátor Auta;Čajka, Vladimír;;Bach.Th.;Katedra;;;BT-2017-0006;;67;1;2017;ČVUT Praha - FEL;ČR;;;;;;;vč. CD;01.06.2017;VOLNÁ;;;;;;;;;;
Algoritmus Generující Operace ve Vícehodnotové Logice;Kozák, Jan;;Bach.Th.;Katedra;;;BT-2017-0007;;28;1;2017;ČVUT Praha - FEL;ČR;;;;;;;vč. CD;19.06.2017;VOLNÁ;;;;;;;;;;
Subjective Speech Intelligibility Testing Methodology Desing Inspired by ITU-T P.807 Deploying Parallel Load and Virtual Reality;Urbanovská, Michaela;;Bach.Th.;Katedra;;;BT-2017-0008;;37;1;2017;ČVUT Praha - FEL;ČR;;;;;;;vč. CD;19.06.2017;VOLNÁ;;;;;;;;;;
Scalable Representations on Natural Networks;Pavlíček, David;;Bach.Th.;Katedra;;;BT-2017-0009;;38;1;2017;ČVUT Praha - FEL;ČR;;;;;;;vč. CD;19.06.2017;VOLNÁ;;;;;;;;;;
Tracking, Learning and Detection Over a Large Range of Speeds;Rozumnyi, Denys;;Bach.Th.;Katedra;;;BT-2017-0010;;36;1;2017;ČVUT Praha - FEL;ČR;;;;;;;vč. CD;19.06.2017;VOLNÁ;;;;;;;;;;
Identification of Cycling Segments in Raw GPS Trajectories;Milec, David;;Bach.Th.;Katedra;;;BT-2017-0011;;39;1;2017;ČVUT Praha - FEL;ČR;;;;;;;vč. CD;19.06.2017;VOLNÁ;;;;;;;;;;
Virtual Bumper for Tracked Ground Robot from Depth Data;Zlámal, Vít;;Bach.Th.;Katedra;;;BT-2017-0012;;38;1;2017;ČVUT Praha - FEL;ČR;;;;;;;vč. CD;19.06.2017;VOLNÁ;;;;;;;;;;
Algiórithms for Minesweeper Game Grid Generation;Cicvárek, Jan;;Bach.Th.;Katedra;;;BT-2017-0013;;81;1;2017;ČVUT Praha - FEL;ČR;;;;;;;vč. CD;19.06.2017;VOLNÁ;;;;;;;;;;
Experimentální Prostředí pro Skupinovou Robotiku;Beránek, Matej;;Bach.Th.;Katedra;;;BT-2017-0014;;56;1;2017;ČVUT Praha - FEL;ČR;;;;;;;vč. CD;19.06.2017;VOLNÁ;;;;;;;;;;
Robustní Postupy Řízení Formací Robotů;Novotný, Martin;;Bach.Th.;Katedra;;;BT-2017-0015;;52;1;2017;ČVUT Praha - FEL;ČR;;;;;;;vč. CD;19.06.2017;VOLNÁ;;;;;;;;;;
Sledování Člověka Robotem;Brandštýl, František;;Bach.Th.;Katedra;;;BT-2017-0016;;56;1;2017;ČVUT Praha - FEL;ČR;;;;;;;vč. CD;19.06.2017;VOLNÁ;;;;;;;;;;
Vizuální Navigace Mobilních Robotů ve Formaci;Žákovec, Martin;;Bach.Th.;Katedra;;;BT-2017-0017;;72;1;2017;ČVUT Praha - FEL;ČR;;;;;;;vč. CD;19.06.2017;VOLNÁ;;;;;;;;;;
Detection and Localization of Texture-less Objects with Deep Neural Networks;Haluza, Pavel;;Bach.Th.;Katedra;;;BT-2017-0018;;37;1;2017;ČVUT Praha - FEL;ČR;;;;;;;vč. CD;19.06.2017;VOLNÁ;;;;;;;;;;
Automatizovaně Řízená Firma na Sledování Vozidel;Havlíček, Jakub;;Bach.Th.;Katedra;;;BT-2017-0019;;57;1;2017;ČVUT Praha - FEL;ČR;;;;;;;vč. CD;19.06.2017;VOLNÁ;;;;;;;;;;
